4/18/2022 8:41:27,"ML, JR, YY",ft110,Both,,Yes,,No,,No,used MetaWin,No,only categorical moderators used,No,,No,,Did not use R,"""To explore ecological and methodological heterogeneity between studies, we investigated the relationship between treatment effects (Hedges’ d) and categorical variables that were defined a priori with random-effects metaregression (univariate and multivariate) in the pro-
gram Metareg (Stata Corporation) (Sharp 1998).""",Did not use R,,No,
4/18/2022 8:48:07,"ML, JR, YY",ft112,Sub-group analysis,"""The summary effect for the meta-analysis was calculated separately for insect and piscivorous predator experiments.""",No,"""The summary effect for the meta-analysis was calculated separately for insect and piscivorous predator experiments.""",No,,No,,No,,NA,,No,,Yes,meta,No,,No,
4/18/2022 9:12:13,"ML, JR, YY",ft115,Both,"Fig4, Qb estimated",Yes,,No,,No,,No,,NA,,No,,Did not use R,MetaWin,Did not use R,MetaWin,No,
4/18/2022 10:16:01,"ML, JR, YY",ft120,Meta-regression,"""""We modeled Hedges' d by applying a linear mixed-effects model with time since addition of dead wood and association of taxa with dead wood (saproxylic or non-saproxylic) as
moderators to test whether the response of saproxylic and non-
saproxylic taxa differed""""",Yes,,No,,No,,Yes,"""We modeled Hedges' d by applying a linear mixed-effects model with time since addition of dead wood and association of taxa with dead wood (saproxylic or non-saproxylic) as
moderators to test whether the response of saproxylic and non-
saproxylic taxa differed""",No,,Yes,Fig A1,Yes,metafor,No,,Yes,PLOT DIGITIZER 2.6.2
5/15/2022 0:03:25,"ML, JR, YY",ft121,Both,We thus included these variables as fixed effects in our linear mixed-effects models and Figure 1 for separate dataset,Yes,full model,No,,No,,Yes,We began with a full model including an interaction between geographic distance and peer review,categorical x continious,We began with a full model including an interaction between geographic distance and peer review,No,Figure 1 is not marginal estimate because variables in right-y-axis are not included in the full model,Did not use R,S-Plus,Did not use R,,No,
5/15/2022 0:29:52,"ML, JR, YY",ft122,Meta-regression,mixed effect model,Yes,table 2,No,,Yes,model selection also table 2,No,,No,no interaction,No,figure 3 comes from separate univariate model,Yes,MCMCglmm,No,,No,
4/18/2022 10:35:49,"ML, JR, YY",ft126,Both,Table1,Yes,Table1,No,,No,,No,,NA,,No,,Yes,metafor,No,,No,
4/18/2022 10:41:33,"ML, JR, YY",ft127,Meta-regression,,Yes,"""We constructed a mixed model with fixed effects for log prey richness, response variable
type, prey type, community subset, consumer taxonomic richness, latitude, and experiment length.""",No,,Yes,"""We constructed a mixed model with fixed effects for log prey richness, response variable
type, prey type, community subset, consumer taxonomic richness, latitude, and experiment length.""",Yes,"""""We constructed a mixed model with fixed effects for log prey richness, response variable
type, prey type, community subset, consumer taxonomic richness, latitude, and experiment length.""",No,,No,,Yes,nlme and lme4,No,,Yes,ImageJ
5/15/2022 0:37:42,"ML, JR, YY",ft131,Meta-regression,,Yes,"laboratory vs. field experiments, damage type, plant growth
form, habitat characteristics, conspecific vs. heterospecific
cues, and the type of response that was measured",No,,Yes,multivariate model - Table S1. But  the also reported results from the univariate models,No,,No,,No,,Yes,MCMCglmm,No,,No,
4/18/2022 10:52:33,"ML, JR, YY",ft133,Both,,Yes,,No,,No,used MetaWin,No,,NA,,No,,Did not use R,MetaWin,Did not use R,MetaWin,No,
5/15/2022 0:44:40,"ML, JR, YY",ft134,Both,"studies were subdivided into corresponding groups, and between-group heterogeneity, mixed-effect models used
was examined using the x2 statistic Q",Yes,"Several potential explanatory variables were tested, including study perspective (plant or herbivore), plant life form (woody, herb, grass), type of defense (chemical, physical,
induced defense, tolerance), phylogeny (plant family), and herbivore type (mammal, insect, mollusk, bird",No,,No,univariate,No,univariate,NA,univariate,No,univariate,Did not use R,MetaWin,Did not use R,,No,
4/18/2022 10:56:47,"ML, JR, YY",ft135,Meta-regression,Fig1,Yes,"""As moderators, we tested level of study (within-species versus across-species comparisons), type of direct  defences (chemical or mechanical) and type of reward (EFNs, domatia and/or food bodies) offered by the plants to ants. """,No,,No,used MetaWin,No,,NA,,No,,Did not use R,MetaWin,Did not use R,MetaWin,No,
5/15/2022 0:51:04,"ML, JR, YY",ft137,Sub-group analysis,"Means are from weighted, random effects categorical meta-analyses for each separate response variable",Yes,trait type,No,,No,,No,,NA,,No,,Yes,metafor,No,,No,
5/15/2022 0:58:24,"ML, JR, YY",ft138,Sub-group analysis,subset by taxonomy,Yes,taxonomy,Yes,SI,No,,No,,NA,,No,,Did not use R,PHYLOMETA,Did not use R,,No,
4/18/2022 11:05:12,"ML, JR, YY",ft139,Both,Fig2,Yes,"""Categorical models were used to compare effect sizes among types of 1) treatments, 2) target invaders, and 3) secondary invaders.""",No,,No,used MetaWin,No,used MetaWin,NA,,No,,Did not use R,MetaWin,Did not use R,MetaWin,Yes,Web Plot Digitizer
5/15/2022 12:28:35,"ML, JR, YY",ft143,Both, table 1 & Regressions of effect sizes against time since herbivory were therefore conducted to determine the importance of such variation for between-class heterogeneity analyses.,Yes,table 1,No,,No,"Table1, univariate",No,univariate,NA,,No,,Did not use R,SAS,Did not use R,,No,
5/15/2022 12:36:43,"ML, JR, YY",ft144,Both,Meta-regressions were performed separately to evaluate the relationships between covariates and effect sizes for above- or below-ground biomass (Table S1),Yes,table S1,No,,No,univariate,No,univariate,NA,univariate,No,,Yes,metafor,No,,Yes,ImageJ
4/18/2022 11:11:29,"ML, JR, YY",ft148,Both,,Yes,"""To explore ecological and methodological heterogeneity between studies, the relationship between treatment effects and categorical variables that were defined a priori was investigated using random effects standardised mean difference meta-regression (univariate and multivariate) in Stata using the program Metareg (Sharp, 1998).""",No,,No,used Stata and MetaWin,No,used Stata and MetaWin,NA,,No,,Did not use R,used Stata and MetaWin,Did not use R,used Stata and MetaWin,No,
5/15/2022 12:49:01,"ML, JR, YY",ft151,Meta-regression,mixed model only,Yes,table 1,No,,Yes,"full model - Models for every possible combination of moderator pairs were fitted, such that the effect of each moderator was modelled together with each one of the rest of the moderators.",No,,No,,No,,Yes,MCMCglmm,No,,No,
4/18/2022 11:19:12,"ML, JR, YY",ft155,Both,Table 1,Yes,,No,,No,,Yes,Appendix 6,categorical x continious,Appendix 6,No,,No,,No,,Yes,SigmaScanPro
5/15/2022 12:56:43,"ML, JR, YY",ft156,Both,separate fixed effect model (table 1) and multivariate regression analyses,Yes,,No,,Yes,,Yes,"latitude, age",No,,Yes,Figure 1,Did not use R,COMPREHENSIVE META-ANALYSIS,No,,Yes,IMAGEJ
4/18/2022 11:26:27,"ML, JR, YY",ft163,Both,"""In order to deal with non-independence of moderators, we analy-
sed effects of moderators within the largest subgroups of data sepa-
rately. Within experiments using perennial grasses, we tested the
effects of fertilization, treatment and setting.""",Yes,Table 1,No,,No,,No,,NA,,No,,Yes,meta,No,,Yes,GraphClick
4/18/2022 11:32:26,"ML, JR, YY",ft164,Meta-regression,,Yes,,No,,Yes,TableS3,Yes,,continious x continious,Table S3 (number of pairs x mass),Yes,Figure 1,Yes,MCMCglmm,No,,No,
5/15/2022 13:03:50,"ML, JR, YY",ft165,Meta-regression,linear mixed models,Yes,only one,No,,No,only one,No,,NA,univariate,No,,Yes,nlme,No,,No,
4/18/2022 12:07:22,"ML, JR, YY",ft166,Both,Table 1,Yes,Table 1,No,,Yes,table 2,No,,categorical x categorical,Table 2,No,e.g. Figure 1 - abundance and diversity run in separate models,Unclear,,No,,No,
4/18/2022 12:15:20,"ML, JR, YY",ft167,Both,"""We ran separate random-effects meta-analyses on effect sizes that were not combined by study,
grouping by transmission mode and response measure.""",Yes,"""Sources of Heterogeneity: Transmission Mode, Response Measure, and Study Type""",No,,No,,No,,NA,,No,,Yes,PhyloMeta in R,No,PhyloMeta in R,No,
4/18/2022 12:25:02,"ML, JR, YY",ft169,Meta-regression,,Yes,,No,,No,,Yes,,No,,No,,Yes,MCMCglmm,No,,No,
4/18/2022 12:31:33,"ML, JR, YY",ft173,Meta-regression,,Yes,,No,,Yes,"""Our final mixed-effects model shows significance in two main effects, but not their interaction: the relationship with the focal species (direct or indirect) and the type of ecological response (abundance, rate or composition).""",No,,categorical x categorical,"""Our final mixed-effects model shows significance in two main effects, but not their interaction: the relationship with the focal species (direct or indirect) and the type of ecological response (abundance, rate or composition).""",Yes,Figure 3,Yes,metafor,No,,No,
5/15/2022 13:10:31,"ML, JR, YY",ft174,Sub-group analysis,subgroups of data divided into pollinator mobility (mobile versus less mobile),Yes,figure 3,No,,No,univariate,No,,NA,,No,,Did not use R,,Did not use R,R style forest plot but not citation,Yes,DATATHIEF
4/18/2022 12:41:23,"ML, JR, YY",ft175,Both,,Yes,""" Similarly, we tested the null hypotheses of no fixed difference in
effect of turf algae on the abundance of canopy algae
recruits between (1) functional groups of turf, (2)
microscopic and macroscopic recruits, and (3) inter-
tidal and subtidal reefs""",No,,No,,No,,NA,,No,,Yes,metafor,No,,Yes,PlotDigitizer
4/18/2022 12:48:14,"ML, JR, YY",ft177,Meta-regression,,Yes,"""We used mixed-effects models (MEMs) with the same random effects to identify host, parasite and methodological correlates of effect sizes. Our full model included the following fixed effects: condition quantification, external measure, size mea-sure, host thermoregulation, parasite type, thermoregulation–parasite type interaction, sampling method, model approach and study duration (for observational data). Candidate sets of all possible MEMs excluding collinear predictors and missing values were generated for each data set """,No,,Yes,"""We used mixed-effects models (MEMs) with the same random effects to identify host, parasite and methodological correlates of effect sizes. Our full model included the following fixed effects: condition quantification, external measure, size mea-sure, host thermoregulation, parasite type, thermoregulation–parasite type interaction, sampling method, model approach and study duration (for observational data). Candidate sets of all possible MEMs excluding collinear predictors and missing values were generated for each data set """,No,"""We used mixed-effects models (MEMs) with the same random effects to identify host, parasite and methodological correlates of effect sizes. Our full model included the following fixed effects: condition quantification, external measure, size mea-sure, host thermoregulation, parasite type, thermoregulation–parasite type interaction, sampling method, model approach and study duration (for observational data). Candidate sets of all possible MEMs excluding collinear predictors and missing values were generated for each data set """,categorical x categorical,Table 3,Yes,Figure S6,Yes,metafor,No,,No,
4/18/2022 12:58:25,"ML, JR, YY",ft179,Both,richnes and abundance analysed separately,Yes,,No,,Yes,,Yes,S2b,"categorical x categorical, categorical x continious","""We also used an information-theoretic approach to evaluate the
potentially non-independent and interactive effects of five of the six
explanatory variables (except ‘type of secondary FS’, due to the small
sample size) in factorial meta-regression models (see Methods""",No,,Yes,metafor,No,,Yes,PlotDigitizer
5/15/2022 13:16:22,"ML, JR, YY",ft188,Both,"in a range of mixed models, with plant traits, life history characteristics and geographic scale as independent variables",Yes,,No,,Yes,table 1 and Supporting table 4,Yes,,categorical x categorical,,No,,Did not use R,SPSS,Did not use R,,No,